{
    "$schema": "urn:pickle:schemas:discovery",
    "discovery-id": "DSC-002",
    "title": "Integration interfaces affected by the MDM upgrade",
    "status": "archived",
    "context": "The MDM platform was upgraded as part of the 1.0.0 baseline. This discovery captured the integration interfaces touching MDM at the time of the change.",
    "request": "List the interfaces in the Interface Catalogue whose source or target is the MDM platform, with the conceptual data entities flowing across each.",
    "scope": { "domain": "integration" },
    "activity": [
        { "timestamp": "2026-02-20T09:15:00Z", "action": "Created", "who": "Joe Bloggs" },
        { "timestamp": "2026-04-01T16:40:00Z", "action": "Archived", "who": "Joe Bloggs" }
    ]
}
