{
    "$schema": "urn:pickle:schemas:discovery",
    "discovery-id": "DSC-001",
    "title": "Which capabilities depend on Oracle CC&B?",
    "status": "archived",
    "context": "The Data & Analytics Programme is consolidating data from Oracle CC&B into the Databricks lakehouse. Before migration we need to understand which business capabilities currently rely on CC&B as their system of record.",
    "request": "Interrogate the business capability catalogue and application landscape to list the Level 2 capabilities whose supporting platform is Oracle CC&B, and flag any with no documented alternative.",
    "scope": {
        "domain": "business",
        "abstraction": "conceptual",
        "artefact": "BUS-CAP"
    },
    "activity": [
        {
            "timestamp": "2026-05-12T10:00:00Z",
            "action": "Created",
            "who": "Joe B"
        },
        {
            "timestamp": "2026-06-28T14:50:18.948Z",
            "action": "Archived",
            "who": "Joe B"
        },
        {
            "timestamp": "2026-06-28T14:50:25.503Z",
            "action": "Archived",
            "who": "Joe B"
        }
    ]
}